{"artifactId":"742c3cdd-d04d-49e8-a7f9-d783d178faac","rules":[{"mappingType":"direct","precedence":0,"ruleId":"rule-1","sourceUniverseId":"prime-projection","targetProjectionRole":"projection-surface"},{"mappingType":"modulated-overlay","precedence":1,"ruleId":"rule-2","sourceUniverseId":"cryptic-support","targetProjectionRole":"projection-surface"}],"schema":"oan.hopng_projection_rules","schemaVersion":"0.1.0"}